{"adjudicatorCount":0,"annotationSessions":[],"annotatorCount":0,"claims":{"calibrated":false,"captureAttestorTrustValid":false,"holdoutFreezeExternalValid":false,"identitySeparationVerified":false,"realHumanAnnotationVerified":false,"ruleReadyForCalibratedClaim":false,"ruleReadyForCalibration":false},"contractVersion":"m3-1-pilot-report-v1","createdAt":"2026-08-24T12:00:00.000Z","documentCount":3,"evidenceTrust":"untrusted","executionStatus":"infrastructure-complete-external-execution-blocked","externalAttestationProof":null,"holdoutFreezeReceipt":null,"identityBindings":[],"limitations":["Two externally identity-bound human blind annotations are not present.","No externally verified holdout freeze receipt is present.","No externally governed attestor trust root has been verified.","No externally trusted capture evidence is present."],"manifestReference":{"artifactContractVersion":"m3-1-public-intake-manifest-v1","artifactId":"intake_manifest_m3_1_public_pilot_v2","artifactSha256":"9c08941796196f7e9a3391c089a0da64dff5400dc3f46fdd1a8273f8a8cf1e00"},"originGroupCount":3,"purpose":"public-corpus-process-feasibility","reportId":"pilot_report_m3_1_public_pilot_v2","samplingPlanId":"sampling_m3_1_public_pilot_v1","samplingPlanSha256":"cce7ce056b3218a2f3e55ca5a6fedc8ab25d2c9aa5dbe2901d153162ea6ec300","trustPolicy":null}
